{
  "$schema": "http://json-schema.org/draft-07/schema#",
  "title": "Spec de pieza (reel) v2",
  "description": "Contrato que Ideacion (IA) llena y el renderer determinista consume. La escena declara ROL + INTENCION + cadena de FUENTES; el render resuelve contra lo que existe.",
  "type": "object",
  "required": ["id", "arquetipo", "formato", "aspect", "fps", "duracion_seg", "marca", "escenas", "audio", "subtitulos", "copy"],
  "additionalProperties": false,
  "properties": {
    "id": { "type": "string" },
    "arquetipo": { "type": "string", "enum": ["promo", "tutorial", "antes_despues", "educativo", "detras_escena", "top_n", "testimonio", "novedad"] },
    "formato": { "type": "string", "enum": ["reel", "post", "carrusel"] },
    "aspect": { "type": "string", "enum": ["9:16", "4:5", "1:1", "16:9"] },
    "fps": { "type": "integer", "minimum": 24, "maximum": 60 },
    "duracion_seg": { "type": "number", "minimum": 3, "maximum": 90 },
    "marca": {
      "type": "object",
      "required": ["nombre", "colores", "fuenteTitulo", "fuenteTexto"],
      "properties": {
        "nombre": { "type": "string" },
        "colores": {
          "type": "object",
          "required": ["primario", "secundario", "acento", "fondo", "texto", "textoInverso"],
          "patternProperties": { "^(primario|secundario|acento|fondo|texto|textoInverso)$": { "type": "string" } },
          "additionalProperties": false
        },
        "fuenteTitulo": { "type": "string" },
        "fuenteTexto": { "type": "string" }
      }
    },
    "escenas": {
      "type": "array",
      "minItems": 1,
      "items": {
        "type": "object",
        "required": ["id", "rol", "t_in", "t_out", "visual"],
        "additionalProperties": false,
        "properties": {
          "id": { "type": "string" },
          "rol": { "type": "string", "enum": ["hook", "producto", "paso", "beneficios", "resultado", "testimonio", "cta", "contexto"] },
          "t_in": { "type": "number", "minimum": 0 },
          "t_out": { "type": "number", "minimum": 0 },
          "scrim": { "type": "string", "enum": ["none", "bottom", "top", "full"] },
          "visual": {
            "type": "object",
            "required": ["intencion", "fuentes"],
            "additionalProperties": false,
            "properties": {
              "intencion": { "type": "string" },
              "fuentes": {
                "type": "array",
                "minItems": 1,
                "description": "Cadena de fallback: el render usa la primera fuente que resuelva.",
                "items": {
                  "type": "object",
                  "required": ["tipo"],
                  "additionalProperties": false,
                  "properties": {
                    "tipo": { "type": "string", "enum": ["asset_cliente", "video_generado", "imagen_generada", "kenburns"] },
                    "archivo": { "type": "string", "description": "Prototipo: candidato en public/. Futuro: resuelto desde el pool." },
                    "match": {
                      "type": "object",
                      "properties": {
                        "categoria": { "type": "string", "enum": ["producto", "proceso", "otro"] },
                        "palabras": { "type": "array", "items": { "type": "string" } }
                      },
                      "additionalProperties": false
                    },
                    "prompt": { "type": "string" },
                    "base": { "type": "string", "enum": ["asset_cliente", "logo", "referencia_marca", "imagen_generada"] },
                    "prompt_movimiento": { "type": "string" }
                  }
                }
              }
            }
          },
          "overlays": {
            "type": "array",
            "items": {
              "type": "object",
              "required": ["componente"],
              "additionalProperties": false,
              "properties": {
                "componente": { "type": "string", "enum": ["TituloIntro", "LowerThird", "CTA", "PasoBadge", "ListaBeneficios"] },
                "props": { "type": "object" }
              }
            }
          }
        }
      }
    },
    "audio": {
      "type": "object",
      "required": ["modo", "voz"],
      "additionalProperties": false,
      "properties": {
        "modo": { "type": "string", "enum": ["propio", "audio_nativo_ig"] },
        "voz": {
          "type": "object",
          "required": ["texto", "voz_tts"],
          "additionalProperties": false,
          "properties": {
            "texto": { "type": "string" },
            "voz_tts": { "type": "string" },
            "rate": { "type": "string" }
          }
        },
        "musica": {
          "type": "object",
          "required": ["src", "volumen"],
          "properties": {
            "src": { "type": "string" },
            "volumen": { "type": "number", "minimum": 0, "maximum": 1 }
          },
          "additionalProperties": true
        }
      }
    },
    "subtitulos": {
      "type": "object",
      "required": ["auto"],
      "additionalProperties": false,
      "properties": {
        "auto": { "type": "boolean" },
        "estilo": { "type": "string" },
        "maxPalabras": { "type": "integer", "minimum": 1, "maximum": 8 }
      }
    },
    "copy": {
      "type": "object",
      "required": ["caption", "hashtags"],
      "additionalProperties": false,
      "properties": {
        "caption": { "type": "string" },
        "hashtags": { "type": "array", "items": { "type": "string" } }
      }
    }
  }
}
